{
  "contract_type": "gate-decision",
  "contract_version": "1.0.0",
  "gate_id": "GATE-000000000001",
  "run_id": "RUN-000000000001",
  "gate_type": "security",
  "subject": "quick-review output may be recorded",
  "decision": "approved",
  "requested_at": "2026-08-16T22:01:40Z",
  "decided_at": "2026-08-16T22:01:45Z",
  "actor_type": "human",
  "actor_id": "user:primary",
  "evidence_artifact_ids": ["ART-000000000001"],
  "policy_decision_ids": ["POL-000000000001"],
  "irreversible_action": false,
  "approval_scope": "This run's internal report only",
  "reason": "The output contains no credentials or personal data.",
  "constraints": ["Do not publish externally"],
  "expires_at": "2026-08-17T22:01:45Z"
}
